{
  "$schema": "https://json-schema.org/draft/2020-12/schema",
  "$id": "https://schemas.ecp-protocol.org/0.3.0/review-run.schema.json",
  "title": "ECP Case Review Run Manifest",
  "description": "Deterministic manifest of one case-review run (M3-CA0, 0.3.0). Records the retained inputs (source document, provenance sidecar, candidate inventory), the engine parameters, the reviewer identity, the explicit reviewed_at timestamp, the adjudications applied, the decision tally, the full artifact chain, and the chain head. run_hash = SHA-256 over the ECP-CANONICAL-JSON-1.0 serialization of this document with the top-level run_hash field removed. The run never writes to the public ledger, never registers cases, never executes anything. Re-deriving the run from the retained inputs must reproduce every artifact hash byte-exactly (verified by review-verify).",
  "type": "object",
  "required": [
    "ecp_object",
    "run_id",
    "run_kind",
    "input",
    "review_parameters",
    "reviewer",
    "reviewed_at",
    "adjudications",
    "decisions",
    "entries",
    "chain_head",
    "protocol_version",
    "schema_version",
    "run_hash"
  ],
  "properties": {
    "ecp_object": {
      "const": "review-run"
    },
    "run_id": {
      "type": "string",
      "pattern": "^ECP-REVRUN-[A-Za-z0-9][A-Za-z0-9._:-]*$"
    },
    "run_kind": {
      "const": "case-review"
    },
    "input": {
      "type": "object",
      "required": [
        "candidates_inspected"
      ],
      "properties": {
        "source_document": {
          "type": "object",
          "required": [
            "label",
            "sha256"
          ],
          "description": "Present iff the run reviewed against the retained source document (the normal, chain-verifiable mode).",
          "properties": {
            "label": {
              "type": "string",
              "minLength": 1
            },
            "sha256": {
              "$ref": "#/$defs/sha256_hex",
              "description": "SHA-256 over the raw bytes of the source candidate-set document the run reviewed."
            }
          },
          "additionalProperties": false
        },
        "provenance_sidecar": {
          "type": "object",
          "required": [
            "label",
            "sha256"
          ],
          "properties": {
            "label": {
              "type": "string",
              "minLength": 1
            },
            "sha256": {
              "$ref": "#/$defs/sha256_hex"
            }
          },
          "additionalProperties": false
        },
        "candidates_inspected": {
          "type": "integer",
          "minimum": 1
        },
        "extraction": {
          "type": "object",
          "required": [
            "extractor",
            "coverage"
          ],
          "properties": {
            "extractor": {
              "type": "string",
              "minLength": 1
            },
            "coverage": {
              "enum": [
                "PASS",
                "FAIL"
              ],
              "description": "PASS iff every line of the source document was accounted for during extraction (no silently dropped content)."
            },
            "coverage_detail": {
              "type": "string"
            }
          },
          "additionalProperties": false
        }
      },
      "additionalProperties": false
    },
    "review_parameters": {
      "type": "object",
      "required": [
        "engine",
        "engine_version",
        "jaccard_overlap_threshold",
        "real_world_registry_size",
        "known_pattern_registry_size"
      ],
      "properties": {
        "engine": {
          "const": "ECP-REVIEW-ENGINE-1"
        },
        "engine_version": {
          "$ref": "#/$defs/semver"
        },
        "jaccard_overlap_threshold": {
          "type": "number",
          "description": "Token-set Jaccard similarity at or above which a within-set overlap suspicion is raised (0 < t < 1)."
        },
        "real_world_registry_size": {
          "type": "integer",
          "minimum": 0,
          "description": "Size of the real-world entity registry; honest registry-driven coverage (small by design, extensible, never claimed exhaustive)."
        },
        "known_pattern_registry_size": {
          "type": "integer",
          "minimum": 0,
          "description": "Size of the known benchmark/puzzle pattern registry (same honest registry-driven policy)."
        }
      },
      "additionalProperties": false
    },
    "reviewer": {
      "type": "object",
      "required": [
        "kind",
        "pipeline",
        "engine_version",
        "operator"
      ],
      "properties": {
        "kind": {
          "const": "deterministic-pipeline"
        },
        "pipeline": {
          "const": "ECP-REVIEW-ENGINE-1"
        },
        "engine_version": {
          "$ref": "#/$defs/semver"
        },
        "operator": {
          "type": "string",
          "minLength": 1
        }
      },
      "additionalProperties": false
    },
    "reviewed_at": {
      "$ref": "#/$defs/iso8601_utc",
      "description": "The explicit timestamp input of the run (determinism is over explicit inputs only)."
    },
    "adjudications": {
      "type": "object",
      "required": [
        "applied",
        "ids"
      ],
      "properties": {
        "applied": {
          "type": "integer",
          "minimum": 0,
          "description": "Number of adjudication records consumed by this run (0 = no owner decisions recorded; owner decisions are never fabricated)."
        },
        "ids": {
          "type": "array",
          "items": {
            "type": "string",
            "pattern": "^ECP-ADJ-[0-9]{6,}$"
          }
        }
      },
      "additionalProperties": false
    },
    "amendments": {
      "type": "object",
      "description": "Case amendments applied in this run (0.4.0, optional): each material amendment entered full re-review; the prior review run is preserved untouched (M3-CA0-A §8).",
      "required": [
        "applied",
        "records"
      ],
      "properties": {
        "applied": {
          "type": "integer",
          "minimum": 0
        },
        "records": {
          "type": "array",
          "items": {
            "type": "object",
            "required": [
              "amendment_id",
              "amendment_hash",
              "candidate_id",
              "disclosure"
            ],
            "properties": {
              "amendment_id": {
                "type": "string",
                "pattern": "^ECP-AMD-[0-9]{6,}$"
              },
              "amendment_hash": {
                "$ref": "#/$defs/sha256_hex"
              },
              "candidate_id": {
                "type": "string",
                "pattern": "^ECP-CAND-[A-Za-z0-9][A-Za-z0-9._:-]*$"
              },
              "disclosure": {
                "enum": [
                  "NONE",
                  "POSSIBLE",
                  "KNOWN"
                ]
              }
            },
            "additionalProperties": false
          }
        }
      },
      "additionalProperties": false
    },
    "lineage": {
      "type": "object",
      "description": "Prior-run linkage (0.4.0, optional): this run re-reviews/amends the retained inputs of a prior preserved run (M3-CA0-A §8: both runs are preserved).",
      "required": [
        "prior_run_id",
        "prior_run_hash",
        "basis"
      ],
      "properties": {
        "prior_run_id": {
          "type": "string",
          "minLength": 1
        },
        "prior_run_hash": {
          "$ref": "#/$defs/sha256_hex"
        },
        "basis": {
          "type": "string",
          "minLength": 1
        }
      },
      "additionalProperties": false
    },
    "decisions": {
      "type": "object",
      "required": [
        "eligible",
        "rejected",
        "requires_review"
      ],
      "properties": {
        "eligible": {
          "type": "integer",
          "minimum": 0
        },
        "rejected": {
          "type": "integer",
          "minimum": 0
        },
        "requires_review": {
          "type": "integer",
          "minimum": 0
        }
      },
      "additionalProperties": false
    },
    "entries": {
      "type": "array",
      "minItems": 1,
      "description": "One row per reviewed candidate, in chain order (intake order).",
      "items": {
        "type": "object",
        "required": [
          "review_id",
          "candidate_id",
          "source_case_id",
          "content_hash",
          "decision",
          "artifact_hash"
        ],
        "properties": {
          "review_id": {
            "type": "string",
            "pattern": "^ECP-REVIEW-[0-9]{6,}$"
          },
          "candidate_id": {
            "type": "string",
            "pattern": "^ECP-CAND-[A-Za-z0-9][A-Za-z0-9._:-]*$"
          },
          "source_case_id": {
            "type": "string",
            "minLength": 1
          },
          "content_hash": {
            "$ref": "#/$defs/sha256_hex"
          },
          "decision": {
            "enum": [
              "ELIGIBLE",
              "REJECTED",
              "REQUIRES_REVIEW"
            ]
          },
          "artifact_hash": {
            "$ref": "#/$defs/sha256_hex"
          }
        },
        "additionalProperties": false
      }
    },
    "chain_head": {
      "$ref": "#/$defs/sha256_hex",
      "description": "artifact_hash of the last artifact in this run (64 zeros is impossible: at least one entry exists)."
    },
    "notes": {
      "type": "array",
      "items": {
        "type": "string"
      }
    },
    "protocol_version": {
      "$ref": "#/$defs/semver"
    },
    "schema_version": {
      "$ref": "#/$defs/semver"
    },
    "run_hash": {
      "$ref": "#/$defs/sha256_hex",
      "description": "SHA-256 over the ECP-CANONICAL-JSON-1.0 serialization of this document with run_hash removed."
    }
  },
  "additionalProperties": false,
  "$defs": {
    "semver": {
      "type": "string",
      "pattern": "^(0|[1-9]\\d*)\\.(0|[1-9]\\d*)\\.(0|[1-9]\\d*)(?:-((?:0|[1-9]\\d*|\\d*[a-zA-Z-][0-9a-zA-Z-]*)(?:\\.(?:0|[1-9]\\d*|\\d*[a-zA-Z-][0-9a-zA-Z-]*))*))?(?:\\+([0-9a-zA-Z-]+(?:\\.[0-9a-zA-Z-]+)*))?$"
    },
    "sha256_hex": {
      "type": "string",
      "pattern": "^[0-9a-f]{64}$"
    },
    "iso8601_utc": {
      "type": "string",
      "pattern": "^\\d{4}-\\d{2}-\\d{2}T\\d{2}:\\d{2}:\\d{2}(\\.\\d+)?Z$"
    }
  }
}
