{
  "ecp_object": "review-run",
  "run_id": "ECP-REVRUN-EXAMPLE",
  "run_kind": "case-review",
  "input": {
    "candidates_inspected": 1,
    "source_document": {
      "label": "synthetic-example-source.md",
      "sha256": "118d64861dadf1129085c5e59b88d3e3ab5fb34efc6a8622cefcd0d5c87d6a74"
    },
    "extraction": {
      "extractor": "source-reparsed-by-review-engine",
      "coverage": "PASS"
    }
  },
  "review_parameters": {
    "engine": "ECP-REVIEW-ENGINE-1",
    "engine_version": "0.3.0",
    "jaccard_overlap_threshold": 0.75,
    "real_world_registry_size": 79,
    "known_pattern_registry_size": 27
  },
  "reviewer": {
    "kind": "deterministic-pipeline",
    "pipeline": "ECP-REVIEW-ENGINE-1",
    "engine_version": "0.3.0",
    "operator": "ECP Review Example Executor"
  },
  "reviewed_at": "2026-01-03T00:00:00Z",
  "adjudications": {
    "applied": 2,
    "ids": [
      "ECP-ADJ-000001",
      "ECP-ADJ-000002"
    ]
  },
  "decisions": {
    "eligible": 1,
    "rejected": 0,
    "requires_review": 0
  },
  "entries": [
    {
      "review_id": "ECP-REVIEW-000001",
      "candidate_id": "ECP-CAND-000001",
      "source_case_id": "S-001",
      "content_hash": "d93ee1810e1a63a07e6a6446b988e5289a85beda959b83b589a9b0cf918d0004",
      "decision": "ELIGIBLE",
      "artifact_hash": "a069c756d187c2fe287cb7cc15336acc15c71273ddd44fc6744699e382aa8b48"
    }
  ],
  "chain_head": "a069c756d187c2fe287cb7cc15336acc15c71273ddd44fc6744699e382aa8b48",
  "notes": [
    "review-layer run: no registration, no execution, no scoring; the public ledger is untouched by design (no code path to it)",
    "FORMAT ILLUSTRATION: public dummy values; no real review run is implied"
  ],
  "protocol_version": "0.3.0",
  "schema_version": "0.3.0",
  "run_hash": "c558f65d3b3abb084ca7ad6502761f1d185e0fa96d8d7e797fa6d62ee8884d85"
}
